[2025-11-08 12:52:56] [INFO] === PAGE ACCESS ===
[2025-11-08 12:52:56] [INFO] Request method: GET
[2025-11-08 12:52:56] [INFO] Search term: ''
[2025-11-08 12:52:56] [INFO] Current session ID: dk31meo6eimvhesrrhar8et3fl
[2025-11-08 12:52:56] [INFO] Final session quantities count: 0
[2025-11-08 12:52:56] [INFO] Items in current view: 50
[2025-11-08 12:52:56] [INFO] Sales Page Load Debug Info:
Array
(
    [total_items] => 3607
    [current_page] => 1
    [total_pages] => 73
    [session_quantities_count] => 0
    [post_quantities_count] => 0
    [date_range] => 2025-11-08 to 2025-11-08
    [days_count] => 1
    [user_id] => 1
    [comp_id] => 1
    [license_type] => FL-II
    [allowed_classes] => Array
        (
            [0] => W
            [1] => V
            [2] => G
            [3] => F
            [4] => D
            [5] => K
            [6] => R
            [7] => O
            [8] => L
            [9] => O
            [10] => O
            [11] => O
            [12] => O
            [13] => M
        )

)

[2025-11-08 12:53:04] [INFO] Session quantity updated: SCMPL0019028 = 100
[2025-11-08 12:53:04] [INFO] Session quantity updated: SCMPL0019028 = 100
[2025-11-08 12:53:06] [INFO] Session quantity updated: SCMPL0019028 = 100
[2025-11-08 12:53:09] [INFO] Session quantity updated: SCMPL0019029 = 50
[2025-11-08 12:53:09] [INFO] Session quantity updated: SCMPL0019029 = 50
[2025-11-08 12:53:11] [INFO] Session quantity updated: SCMPL0019029 = 50
[2025-11-08 12:54:00] [INFO] === PAGE ACCESS ===
[2025-11-08 12:54:00] [INFO] Request method: GET
[2025-11-08 12:54:00] [INFO] Search term: ''
[2025-11-08 12:54:00] [INFO] Current session ID: dk31meo6eimvhesrrhar8et3fl
[2025-11-08 12:54:00] [INFO] Final session quantities count: 2
[2025-11-08 12:54:00] [INFO] Items in current view: 50
[2025-11-08 12:54:00] [INFO] Sales Page Load Debug Info:
Array
(
    [total_items] => 150
    [current_page] => 1
    [total_pages] => 3
    [session_quantities_count] => 2
    [post_quantities_count] => 0
    [date_range] => 2025-11-08 to 2025-11-08
    [days_count] => 1
    [user_id] => 1
    [comp_id] => 1
    [license_type] => FL-II
    [allowed_classes] => Array
        (
            [0] => W
            [1] => V
            [2] => G
            [3] => F
            [4] => D
            [5] => K
            [6] => R
            [7] => O
            [8] => L
            [9] => O
            [10] => O
            [11] => O
            [12] => O
            [13] => M
        )

)

[2025-11-08 12:54:11] [INFO] === PAGE ACCESS ===
[2025-11-08 12:54:11] [INFO] Request method: GET
[2025-11-08 12:54:11] [INFO] Search term: ''
[2025-11-08 12:54:11] [INFO] Current session ID: dk31meo6eimvhesrrhar8et3fl
[2025-11-08 12:54:11] [INFO] Final session quantities count: 2
[2025-11-08 12:54:11] [INFO] Items in current view: 50
[2025-11-08 12:54:11] [INFO] Sales Page Load Debug Info:
Array
(
    [total_items] => 150
    [current_page] => 1
    [total_pages] => 3
    [session_quantities_count] => 2
    [post_quantities_count] => 0
    [date_range] => 2025-11-08 to 2025-11-08
    [days_count] => 1
    [user_id] => 1
    [comp_id] => 1
    [license_type] => FL-II
    [allowed_classes] => Array
        (
            [0] => W
            [1] => V
            [2] => G
            [3] => F
            [4] => D
            [5] => K
            [6] => R
            [7] => O
            [8] => L
            [9] => O
            [10] => O
            [11] => O
            [12] => O
            [13] => M
        )

)

[2025-11-08 12:54:14] [INFO] === PAGE ACCESS ===
[2025-11-08 12:54:14] [INFO] Request method: GET
[2025-11-08 12:54:14] [INFO] Search term: ''
[2025-11-08 12:54:14] [INFO] Current session ID: dk31meo6eimvhesrrhar8et3fl
[2025-11-08 12:54:14] [INFO] Final session quantities count: 2
[2025-11-08 12:54:14] [INFO] Items in current view: 50
[2025-11-08 12:54:14] [INFO] Sales Page Load Debug Info:
Array
(
    [total_items] => 150
    [current_page] => 1
    [total_pages] => 3
    [session_quantities_count] => 2
    [post_quantities_count] => 0
    [date_range] => 2025-11-08 to 2025-11-08
    [days_count] => 1
    [user_id] => 1
    [comp_id] => 1
    [license_type] => FL-II
    [allowed_classes] => Array
        (
            [0] => W
            [1] => V
            [2] => G
            [3] => F
            [4] => D
            [5] => K
            [6] => R
            [7] => O
            [8] => L
            [9] => O
            [10] => O
            [11] => O
            [12] => O
            [13] => M
        )

)

[2025-11-08 12:54:20] [INFO] === PAGE ACCESS ===
[2025-11-08 12:54:20] [INFO] Request method: GET
[2025-11-08 12:54:20] [INFO] Search term: ''
[2025-11-08 12:54:20] [INFO] Current session ID: dk31meo6eimvhesrrhar8et3fl
[2025-11-08 12:54:20] [INFO] Final session quantities count: 2
[2025-11-08 12:54:20] [INFO] Items in current view: 50
[2025-11-08 12:54:20] [INFO] Sales Page Load Debug Info:
Array
(
    [total_items] => 3607
    [current_page] => 1
    [total_pages] => 73
    [session_quantities_count] => 2
    [post_quantities_count] => 0
    [date_range] => 2025-11-08 to 2025-11-08
    [days_count] => 1
    [user_id] => 1
    [comp_id] => 1
    [license_type] => FL-II
    [allowed_classes] => Array
        (
            [0] => W
            [1] => V
            [2] => G
            [3] => F
            [4] => D
            [5] => K
            [6] => R
            [7] => O
            [8] => L
            [9] => O
            [10] => O
            [11] => O
            [12] => O
            [13] => M
        )

)

[2025-11-08 12:54:27] [INFO] === PAGE ACCESS ===
[2025-11-08 12:54:27] [INFO] Request method: GET
[2025-11-08 12:54:27] [INFO] Search term: ''
[2025-11-08 12:54:27] [INFO] Current session ID: dk31meo6eimvhesrrhar8et3fl
[2025-11-08 12:54:27] [INFO] Final session quantities count: 2
[2025-11-08 12:54:27] [INFO] Items in current view: 50
[2025-11-08 12:54:27] [INFO] Sales Page Load Debug Info:
Array
(
    [total_items] => 3607
    [current_page] => 1
    [total_pages] => 73
    [session_quantities_count] => 2
    [post_quantities_count] => 0
    [date_range] => 2025-11-08 to 2025-11-08
    [days_count] => 1
    [user_id] => 1
    [comp_id] => 1
    [license_type] => FL-II
    [allowed_classes] => Array
        (
            [0] => W
            [1] => V
            [2] => G
            [3] => F
            [4] => D
            [5] => K
            [6] => R
            [7] => O
            [8] => L
            [9] => O
            [10] => O
            [11] => O
            [12] => O
            [13] => M
        )

)

[2025-11-08 12:55:20] [INFO] === PAGE ACCESS ===
[2025-11-08 12:55:20] [INFO] Request method: POST
[2025-11-08 12:55:20] [INFO] Search term: ''
[2025-11-08 12:55:20] [INFO] Current session ID: dk31meo6eimvhesrrhar8et3fl
[2025-11-08 12:55:20] [INFO] Session quantities updated from POST: 2 items
[2025-11-08 12:55:20] [INFO] Getting next bill number for CompID: 1
[2025-11-08 12:55:20] [INFO] Next bill number for CompID 1: 25
[2025-11-08 12:55:20] [INFO] Starting optimized cash memo generation for 19 bills
[2025-11-08 12:55:21] [INFO] Cash memo generated for bill: BL0025
[2025-11-08 12:55:21] [INFO] Cash memo generated for bill: BL0026
[2025-11-08 12:55:21] [INFO] Cash memo generated for bill: BL0027
[2025-11-08 12:55:21] [INFO] Cash memo generated for bill: BL0028
[2025-11-08 12:55:21] [INFO] Cash memo generated for bill: BL0029
[2025-11-08 12:55:21] [INFO] Cash memo generated for bill: BL0030
[2025-11-08 12:55:21] [INFO] Cash memo generated for bill: BL0031
[2025-11-08 12:55:21] [INFO] Cash memo generated for bill: BL0032
[2025-11-08 12:55:21] [INFO] Cash memo generated for bill: BL0033
[2025-11-08 12:55:21] [INFO] Cash memo generated for bill: BL0034
[2025-11-08 12:55:21] [INFO] Cash memo generated for bill: BL0035
[2025-11-08 12:55:21] [INFO] Cash memo generated for bill: BL0036
[2025-11-08 12:55:21] [INFO] Cash memo generated for bill: BL0037
[2025-11-08 12:55:21] [INFO] Cash memo generated for bill: BL0038
[2025-11-08 12:55:21] [INFO] Cash memo generated for bill: BL0039
[2025-11-08 12:55:21] [INFO] Cash memo generated for bill: BL0040
[2025-11-08 12:55:21] [INFO] Cash memo generated for bill: BL0041
[2025-11-08 12:55:21] [INFO] Cash memo generated for bill: BL0042
[2025-11-08 12:55:21] [INFO] Cash memo generated for bill: BL0043
[2025-11-08 12:55:21] [INFO] Cash memo generation completed: 19 successful, 0 failed
[2025-11-08 12:55:21] [INFO] Session quantities cleared
